what type of exercises should i engage it to increase my restfulness?	you can also try progressive muscle relaxation, a technique that involves sequentially tensing and then relaxing each muscle, from your toes to your head. music, meditation, and visualization may also help. if you lie in bed trying to fall asleep and more than 20 minutes pass, get up and go into another room. you want your brain to associate your bed with rest, not tossing and turning. it may help to do something that is quiet and relaxing. you might listen to some soothing music, draw or color, or read a nonfiction book. avoid using your cellphone, or turning on the tv or computer when you cannot fall asleep.	music, meditation, and visualization
how to i reduce waking up at night?	up to 85 % of women with menopause experience hot flashes. when a hot flash occurs during the night, the sudden increase in body temperature and adrenaline wakes you up, making it tough to fall back asleep. various medications include sleep problems as a symptom. these medications include some stimulants, antidepressants, over - the - counter cold medicines and decongestants, and some medications for high blood pressure, heart disease, allergies, asthma, adhd, and parkinson's. even something as innocent as your bedroom environment can be the culprit behind your disrupted sleep. bedrooms that are too hot, bright, or noisy can keep waking you up at night.	bedrooms that are too hot, bright, or noisy
what is the reasoning behind whether someone is a night owl or morning lark?	most experts advise against jarring awakenings for people who are in the middle of a sleepwalking episode. because they aren't aware of their situation, a jolting awakening may provoke fear, confusion, or anger. if possible, you can try to lightly guide a sleepwalking person away from potential dangers and back to bed. a quiet, soothing voice and at most a light touch may be useful in directing them. if you do need to wake up a person who is sleepwalking, try to do so in a way that is as gentle as possible, and be aware that they will most likely be disoriented upon waking up.	a jolting awakening may provoke fear, confusion, or anger
what is good sleep?	dreams appear to be an important part of normal, healthy sleep. at the same time, though, nightmares can disrupt sleep and even affect a person during their waking hours. given that virtually everyone has dreams, both good and bad, it's natural to wonder how dreaming affects sleep quality, whether nightmares are bad for sleep, and how to avoid bad dreams. dreaming is a normal part of healthy sleep. good sleep has been connected to better cognitive function and emotional health, and studies have also linked dreams to effective thinking, memory, and emotional processing. in this way, many experts believe dreaming is either a reflection of or a contributor to quality sleep.	connected to better cognitive function and emotional health
is it normal to snore?	people snore at night due to a variety of physical and physiological factors. during sleep, the tongue recedes to the back of the mouth, and the throat muscles relax. snoring happens when these structures partially obstruct the flow of air through your mouth and nose, causing air to flow faster and resulting in vibrations in the walls of your throat. light snoring that is not accompanied by other symptoms may be mildly disruptive, but it is not typically considered a cause for concern. however, whether snoring is bad for you depends on several factors. although many individuals can sleep soundly while snoring, someone sharing their bedroom or bed may have trouble sleeping due to the noise.	people snore at night due to a variety of physical and physiological factors.
how do i sleep earlier	but the parents also have a heavy influence when it comes to sleepand one of the things i hope i made clear in those first few chapters is that, to some degree, sleeping is a skill. the mindset, the anxieties, the expectations we take with us into the bedroom, often start at a very young age. when an adult comes in [ to my office ] and says, oh doctor, i've been a bad sleeper since i was a kid. i find that sentence to be absolutely fascinating. what does that mean? like you fall out of bed a lot?	sleeping is a skill
what should i do if i constantly feel tired in daytime?	since a good night's rest is essential for bodily recovery and repair, those who don't get enough sleep on a regular basis are at higher risk for certain disorders, including high blood pressure, cardiovascular disease, obesity, diabetes, and depression. as you can see from our recommendations, the amount of sleep you should get each night will evolve over the course of your life. if you feel tired during the day after a night without enough sleep, you may be able to alleviate your tiredness by simply getting more rest. another remedy may be improving your sleep hygiene by going to bed and waking up at the same times each day, avoiding caffeine in the afternoon and evenings, and maintaining a relaxing bedroom environment. however, persistent feelings of excessive daytime tiredness may warrant a doctor's visit - especially if you sleep for the recommended amount of time each night.	you may be able to alleviate your tiredness by simply getting more rest
why am i able to sleep more soundly on a rainy day?	although a cough is the symptom that is most likely to wake you up at night when you have a cold, other cold symptoms such as aches and pains, a sore throat, runny nose, and the need to sneeze might also disturb your sleep. people experiencing a fever may have fever dreams. these unusual, negative dreams could also make sleeping more difficult while you are sick. although you may not succeed in entirely eliminating your symptoms overnight, there are some habits that may help you enjoy more restorative sleep as you recover. if your cough is made worse by asthma, seasonal allergies, or other conditions, you may also need to treat these conditions to help relieve your cough.	there are some habits that may help you enjoy more restorative sleep as you recover.
what can i do to make my sleeping environment quieter/conducive for sleep?	while music can help you sleep, unwelcome noise can disturb your sleep, even if you do not fully wake up. it helps to make your bedroom as quiet as possible. if you live somewhere noisy, consider wearing headphones to listen to your music. we also need darkness to sleep well. avoid using your tv or computer to play music, as the blue light emanating from the screen can keep you awake. it is okay to use a smartphone or other device with a screen as long as the music can play while the screen stays dark. it can take some time to find the right music, volume, and duration to best soothe you to sleep.	it helps to make your bedroom as quiet as possible
what are some sleep hygiene tips	several steps can help avoid the dangers of drowsy driving. some tips are beneficial right before or during a trip, and others work to build lifestyle habits for healthy sleep. over the long - term, good sleep is the best protection against drowsy driving. focusing on sleep hygiene, which includes your habits and sleep setting, can enable better sleep every night. examples of sleep hygiene include maintaining a stable sleep schedule, limiting the use of electronic devices before bed, and making sure that your bedroom is quiet, dark, and conducive to uninterrupted rest. in addition to sleep hygiene improvements, you should talk with a doctor if you have persistent or severe problems with falling or staying asleep or if you regularly have daytime sleepiness. working with your doctor can identify the optimal approach to enhancing your sleep, which may involve testing to determine if you are affected by an underlying sleep disorder.	beneficial right before or during a trip, and others work to build lifestyle habits for healthy sleep
is drug-induced sleep the same as normal sleep?	examples include blood pressure drugs, anti - asthma medications, and antidepressants. other drugs may cause daytime drowsiness that can throw off a person's sleep schedule. it's not just taking medications that can interrupt sleep. when someone stops taking a drug, withdrawal or other aspects of the body's reaction can create difficulties for sleep. problems affecting the brain, including neurodegenerative and neurodevelopmental disorders, have been found to be associated with an elevated risk of insomnia. neurodegenerative disorders, such as dementia and alzheimer's dementia, can throw off a person's circadian rhythm and perception of daily cues that drive the sleep - wake cycle.	other drugs may cause daytime drowsiness that can throw off a person's sleep schedule.
how can i be flexible in adjusting my sleep and exercise schedule around social events?	ask your friends and family to be more flexible with meeting times, perhaps suggesting activities that can be done at any time of day, such as going for a walk. those with a strong understanding of their sleep schedule can try scheduling activities for weeks when they know they will sleep better. making friends with other people in similar situations, such as shift workers or freelancers, may also open up more scheduling possibilities. there are plenty of alternative options for keeping in touch with friends outside regular hours, though some of these might not be appropriate if you are on strict therapy to keep a 24 - hour schedule.	ask your friends and family to be more flexible with meeting times
can i eat supper before going to bed?	if you are worried about eating too much before bed, you may want to try mixing your protein powder with almond milk or water for a lower - calorie option. hot or cold oatmeal might help prepare your body for sleep and keep you full throughout the night. oats contain magnesium as well as melatonin, the sleep hormone. consider making a batch of overnight oats with dried fruits and seeds for a simple nighttime snack option. fruit is another way to get in your essential vitamins and minerals. eating certain fruits before bed may also help you sleep better.	you may want to try mixing your protein powder with almond milk or water
what kind of stressors can cause our body to sleep	your bed should only be used for sleep and sex. at night, follow a bedtime routine to help you unwind from the day. performing the same set of activities every night also signals to your brain that it's time to sleep. stop using your electronics at least 1 hour before bed, and turn down the lights. instead, enjoy a relaxing activity like reading a book or taking a bath. listen to something calming, like a guided meditation or gentle music. stress makes sleep difficult, pandemic or not. regular exercise, journaling, and taking a break from the news may help relieve stress and improve your sleep.	regular exercise, journaling, and taking a break from the news
what affects my sleep?	sleep can also affect mood and perception, including how a person perceives their skin and overall appearance. women who sleep well tend to be more satisfied with their appearance than women who do not sleep well. this satisfaction may be due in part to how they are perceived in the world. studies have demonstrated that someone who is sleep deprived is perceived as less attractive. as a result of sleep deprivation, they might have dark circles under their eyes, swollen eyelids, and a puffy face. there is also a correlation between appearing tired and appearing sad.	sleep can also affect mood and perception, including how a person perceives their skin and overall appearance
how can i sleep better?	if you prefer to go to sleep later, try not to get too much light in the morning hours. instead, go for an evening walk or use light therapy later in the day. this can help delay the release of melatonin and trick your body into delaying your bedtime. an easy way to improve sleep is by adopting sleep hygiene habits that strengthen the circadian rhythm and create a mental association between bed and sleep. you should also make it a priority to treat any underlying sleep disorders or other conditions such as chronic conditions such as diabetes, heart failure, or prostate disorders. talk to your doctor to see if you can adjust your medication schedule to minimize the effects on your sleep. in the short term, your doctor may prescribe melatonin supplements or cognitive behavioral therapy for insomnia ( cbt - i ) to help re - establish a healthy sleep pattern.	adopting sleep hygiene habits that strengthen the circadian rhythm and create a mental association between bed and sleep
why am i easy to wake up?	waking up in the middle of the night when you would like to be asleep can be a frustrating experience. people wake up during the night for different reasons. identifying the cause of your middle - of - the - night wakings is the first step toward a full night of sound sleep. many factors cause people to wake up during the night, such as disruptions in the environment, lifestyle factors, health issues, and aging. we explore the possibilities of what might be waking you up at night. sleep hygiene tips often include the advice to maintain a quiet, dark, cool bedroom, as sensory disturbances can wake a person up during the night.	can be a frustrating experience. people wake up during the night for different reasons
i often use eye drops to help sleep before going to bed. is this a healthy way?	even if you do not want to sleep with contacts in, you might find yourself accidentally falling asleep before taking them out on occasion. once you wake up, it is important to remove your contacts as soon as possible. first, check that you can easily remove them. if they feel stuck, do not pull at them. instead, use eye drops and blink until they are easy to remove. then, give your eyes a break. avoid wearing contacts for at least a day and pay close attention to how your eyes feel. if you notice any symptoms indicating infection, stop wearing your contact lenses and call your eye doctor immediately.	use eye drops and blink until they are easy to remove
how do i ensure that i get good quality of sleep if i am always randomly waking up during my sleep?	there are several strategies you can try to help you sleep through the night. follow a regular sleep schedule every day, even on weekends. avoid napping during the day, especially for longer than 30 minutes and past the late afternoon. adopt a calming bedtime routine to ease you into sleep each night. if you think exercise is keeping you up, switch your exercise routine to the morning to see if that helps. jotting down your thoughts can be especially helpful if you think stressful thoughts are waking you up during the night. get your worries out of your head and onto the paper.	get your worries out of your head and onto the paper
i love working at night and i am happy to sleep at daytime. should i stick to my sleeping/waking schedule?	sleep experts emphasize the importance of creating an association in your mind between your bed and sleep. for this reason, they often recommend that sleep and sex be the only activities that take place in your bed. this means that working - from - home shouldn't be working - from - bed. it also means avoiding bringing a laptop into bed to watch a movie or series. on any given night, if you find that you're having a hard time sleeping, don't spend more than 20 minutes tossing and turning. instead, get out of bed and do something relaxing in very low light, and then head back to bed to try to fall asleep.	working - from - home shouldn't be working - from - bed
how long should a person sleep?	although the purpose of sleep is still somewhat of a mystery, experts know that sleeping affects nearly every part of the human body. as a result, falling short on sleep increases a person's risk of a variety of health problems, ranging from diabetes to depression. to remain healthy, people require adequate sleep on a regular basis. most adults should sleep for seven or more hours each night to avoid negative health effects, according to the american academy of sleep medicine ( aasm ) and the sleep research society ( srs ). however, exactly how much sleep an individual person needs varies depending on their age and other health factors.	seven or more hours each night
what is the relationship between good sleep and performance?	to enjoy the maximum benefits of good sleep, you need to sleep well for at least a week leading up to your exam. in one study, researchers found that the previous night's sleep had no impact on test scores. when researchers assessed the students'sleeping habits leading up to an exam, however, they discovered that those who slept longer and enjoyed better sleep quality in the week and the month beforehand did get better grades. in fact, researchers estimate the better sleep accounted for nearly 25 % of the difference in academic performance. to understand why sleep can positively impact grades, it's helpful to understand how sleep works.	nearly 25 % of the difference in academic performance.
how do you know if you are sleep deprived	sleep deprivation is a major problem because of how it can negatively impact health. for example, sleep deprivation increases your risk of heart disease and diabetes, among other problems. some people believe sleeping naked helps them fall asleep faster and stay asleep longer. however, researchers haven't directly studied these potential benefits of sleeping nude. if sleeping naked helps you receive the recommended seven to nine hours of sleep each night, then it's worth trying. research suggests that sleeping naked may potentially positively impact reproductive health, connection with a partner, and self - esteem. our bodies are regulated by our circadian rhythm, which cycles through heating and cooling patterns throughout the day.	if sleeping naked helps you receive the recommended seven to nine hours of sleep each night
how does lack of sleep affect my mental health?	a lack of sleep also increases irritability and risk for anxiety and depression. physically, a lack of sleep increases the risk for many medical concerns, including type 2 diabetes, high blood pressure, kidney disease, and stroke. while quality sleep has positive effects specifically on athletic performance, a lack of sleep is detrimental to performance. evidence shows that more sleep, or extended sleep, can benefit athletes, their recovery, and their performance. recommendations for athletes range between seven and nine hours nightly. elite athletes are encouraged to get at least nine hours of sleep nightly and to treat sleep with as much importance as athletic training and diet.	increases irritability and risk for anxiety and depression
can i do extensive workout before i sleep?	adopting healthy sleep habits and obtaining a consistent, adequate amount of sleep each night is more beneficial than relying on naps or weekend sleep - ins. however, for shift workers or others who aren't able to sleep the required amount, trying tips for sleep debt recovery or taking the occasional sleep vacation might go a long way toward helping them feel more rested. if you've accrued sleep debt, getting back to a healthy sleep schedule may require some time and effort. there are some measures you can take to recover from sleep debt.	adopting healthy sleep habits and obtaining a consistent, adequate amount of sleep each night
it is hard to reduce digital screentime, what are the alternatives?	ideally, the bedroom should be a screen - free zone. reserving the bedroom for sleep helps the brain wind down. however, it's not always feasible to keep technology out of the bedroom. if your teen must use technology in the bedroom, ask them to turn their devices off about an hour before bedtime. glasses or applications designed to filter out blue light also appear to minimize disruptions to teenagers'sleep. to help teenagers adopt healthy screen habits, parents should strive to be positive role models by limiting their own screen use.	glasses or applications designed to filter out blue light
how long should my naps be?	napping can be refreshing if you're short on sleep while traveling, but it's important not to go overboard with naps. if you nap for too long, you may wake up even groggier. long naps or naps in the late afternoon or evening can also throw off your sleep schedule. in order to get the benefits of naps without many downsides, try to nap for less than 30 minutes and a maximum of 60 minutes. the best time to nap is usually shortly after lunch, and naps later in the day should be avoided.	less than 30 minutes and a maximum of 60 minutes
what are the biological processes of sleep?	even after decades of research, the exact reason why we sleep remains one of the most enduring and intriguing mysteries in health science. to try to get to the bottom of this question, experts analyze how sleep works and what happens when we don't get enough sleep. studies demonstrate that sleep is incredibly complex and has effects on virtually all systems of the body. multiple parts of the brain are involved in the processes of producing hormones and chemicals that regulate sleep and wakefulness. while there is much that is still to be learned about the intricacies of how sleep works, existing research sheds light on the mechanics of what happens in the brain and body during sleep.	producing hormones and chemicals that regulate sleep and wakefulness
does sleep help with overcoming stress	your bed should only be used for sleep and sex. at night, follow a bedtime routine to help you unwind from the day. performing the same set of activities every night also signals to your brain that it's time to sleep. stop using your electronics at least 1 hour before bed, and turn down the lights. instead, enjoy a relaxing activity like reading a book or taking a bath. listen to something calming, like a guided meditation or gentle music. stress makes sleep difficult, pandemic or not. regular exercise, journaling, and taking a break from the news may help relieve stress and improve your sleep.	regular exercise, journaling, and taking a break from the news
is it okay for me to exercise right before bed?	one study noted that participants who exercised in the morning fell asleep faster at night, while those who worked out before bed stayed asleep longer. another found that vigorous exercise before bed increased heart rate, making it difficult to fall asleep. a third study determined that exercise timing does not affect sleep quality at all. in general, it is fine to work out at any time of day. that said, some researchers suggest that you should stop exercising at least 90 minutes before sleep. this time allows heart rate to slow down and body temperature to return to normal.	vigorous exercise before bed increased heart rate, making it difficult to fall asleep
is snoring a bad sign for average-sized people?	whether snoring is dangerous depends on its type, severity, and frequency. if you have noticed any of these signs, it's important to address the issue with a doctor who can determine if additional testing or treatment is necessary. unless someone else tells them, most people who snore aren't aware of it, and this is part of why sleep apnea is underdiagnosed. if you sleep alone, your best bet is to set up a recording device. it could be an old - school tape recorder or one of many smartphone apps, but the apps have the advantage of analyzing sound patterns for you to detect likely episodes of snoring.	whether snoring is dangerous depends on its type, severity, and frequency
how can i make my sleep environment more conducive?	also, be sure your sleep environment is cool, dark, and noise - free. you may also want to try relaxing activities in the evening to prepare you for sleep, such as reading or gentle yoga. keep electronics away to avoid blue light disrupting your circadian rhythm. just like a skincare routine, finding a good sleep routine takes some practice. with a little patience, you'll discover what works well for you and that beauty sleep will come easier.	cool, dark, and noise - free
how much sleep is enough if i haven't been sleeping well lately?	when you sleep well, the background music is upbeat and positive, so you interpret people's behaviors and daily events with humor and optimism. when you miss sleep, the mood music darkens, and suddenly people have questionable motives. life takes on a more negative and gloomy tone. research closely connects lost sleep with deteriorating mental health. a recent study of adolescents in the u. k. found that teens who slept less at age 15 were significantly more likely to have symptoms of depression and anxiety at age 17 and in their early 20s. those diagnosed with depression went to bed later, woke up more during the night, and were more likely to say they felt very sleepy during the day than those without a mental health diagnosis.	the background music is upbeat and positive
why do i frequently experience heartburn or acid reflux at night (close to my bedtime)?	the les is a muscle at the end of your esophagus that usually tightens to keep your stomach's contents in your stomach. however, this muscle can become weak or relaxed at the wrong times. while anyone can experience heartburn after a heavy meal, experiencing heartburn frequently may mean that it is a symptom of gastroesophageal reflux disease ( gerd ). often, people use the term heartburn interchangeably with gerd. however, heartburn is a symptom of gerd, not the disorder itself. gerd symptoms are a bit more severe. research shows that over 60 % of people suffering from heartburn or another reflux - related disease report disruptions in their sleep.	it is a symptom of gastroesophageal reflux disease
