i play mahjong with my friends in hall very often and it messed up my sleep cycle alot, what should i do?	it's out in the open your hamstring hurts, let's talk about it so we can figure out we need to do something. but we don't sometimes talk about sleep in meaningful ways. so my hope is this book creates a conversation about it, because i don't think we can talk about it too much. and so when you're out with your friends, and you're talking about, my kid does this in his sleep and i read something about that one time, my hope is that this gets people talking, and moving in directions of finding that solution.	my hope is that this gets people talking, and moving in directions of finding that solution
what are the advantages of sleep?	the key benefits of an at - home sleep apnea test compared to traditional polysomnography are shorter wait times and increased convenience, affordability, and comfort. the alternative to an at - home sleep apnea test is an overnight sleep study conducted in a lab. sleep centers aim to make these comfortable by providing a nice bedroom. however, you are still sleeping somewhere that feels unfamiliar, and there are technicians monitoring you while you sleep. for people who find that uncomfortable, a sleep apnea test at home may be preferable. at - home sleep apnea tests are generally more convenient than a polysomnogram.	shorter wait times and increased convenience, affordability, and comfort
what should i eat to get better sleep?	it can also help to eat more frequently, in smaller amounts, and avoid certain foods that make your symptoms worse. a diet rich in whole grains, fruits, and vegetables can help reduce pms symptoms. eating a large dinner may make it more difficult for your body to relax during sleep, so consider reducing portion sizes in the evening especially. ask your healthcare provider about nutritional supplements that may help relieve symptoms. regular exercise in general and higher - intensity exercise in the lead - up to your period can help reduce the severity of pms symptoms. good options include yoga, swimming, or other forms of aerobic exercise.	a diet rich in whole grains, fruits, and vegetables
what kinds of sleep disorders are there?	ear, nose, and throat doctors - formally called otorhinolaryngologists - are also able to diagnose and treat certain sleep disorders related to the upper throat and airways. check with your primary care doctor for referrals or recommendations of local otorhinolaryngologists. you may also want to check with your insurance provider to make sure your visit is covered. if your sleep disruptions persist over long periods of time, you may want to consider visiting a sleep clinic. sleep disorders are a group of symptoms and experiences that impact your ability to fall asleep or stay asleep and your ability to feel rested the next day.	a group of symptoms and experiences
how do i prolong rem sleep?	during this stage, the eyes move rapidly behind closed eyelids, and brain activity consists of smaller, faster waves, called theta waves, that are similar to wakefulness. most muscles become temporarily paralyzed during rem sleep to prevent accidental harm from acting out dreams, although individuals may display occasional muscle twitches. heart rate increases, and breathing quickens and becomes uneven. someone woken during rem sleep often appears relatively alert, in contrast to those woken during deep sleep. periods of rem sleep occur at roughly 90 - minute intervals throughout the night and generally become longer as the night wears on, starting at 10 minutes long and lasting as long as one hour.	starting at 10 minutes long and lasting as long as one hour
is it bad to sleep on a full stomach? what about an empty stomach?	if you frequently find yourself waking up to go to the washroom, you may also choose to drink less fluids overall before bed. a recent study found that eating within three hours of bedtime may lead to more nighttime awakenings. eating a heavy meal right before lying down can also cause heartburn, with accompanying discomfort that may make it even more difficult to sleep. if you suffer from heartburn, try to avoid fried, spicy, or acidic foods close to bedtime. for those who have trouble sleeping through the night on an empty stomach, the best option is to enjoy a small, nutritious bedtime snack.	to enjoy a small, nutritious bedtime snack
does mood or emotions affect sleep quality?	sleep can also affect mood and perception, including how a person perceives their skin and overall appearance. women who sleep well tend to be more satisfied with their appearance than women who do not sleep well. this satisfaction may be due in part to how they are perceived in the world. studies have demonstrated that someone who is sleep deprived is perceived as less attractive. as a result of sleep deprivation, they might have dark circles under their eyes, swollen eyelids, and a puffy face. there is also a correlation between appearing tired and appearing sad.	sleep can also affect mood and perception, including how a person perceives their skin and overall appearance.
what is the cause of snoring?	snoring is caused by the rattling and vibration of tissues near the airway in the back of the throat. during sleep, the muscles loosen, narrowing the airway, and as we inhale and exhale, the moving air causes the tissue to flutter and make noise like a flag in a breeze. some people are more prone to snoring because of the size and shape of the muscle and tissues in their neck. in other cases, excess relaxing of the tissue or narrowing of the airway can lead to snoring. though people of any age, including children, can snore, it is more common in older people.	the rattling and vibration of tissues near the airway in the back of the throat
i always wake up in the middle of the night feeling breathless, what is wrong with me?	during sleep inertia, you are still not fully alert, and you want to go back to sleep rather than get out of bed and begin your day. sleep inertia is a normal feeling we all experience as we transition from being asleep to being fully awake. people tend to experience more intense sleep inertia when they are sleep deprived. if you are part of the one - third of americans sleeping less than seven hours per night, your tendency to hit snooze could be the result of not obtaining enough sleep. trouble waking up is also more common in people with certain sleep disorders, mood disorders, and jobs that require them to wake up at unusual hours.	your tendency to hit snooze could be the result of not obtaining enough sleep
is it okay to catch up on sleep debt over the weekends?	when they get extra sleep on weekends, studies show that it reduces their late - night cravings on those nights. however, once these sleepers return to the sleep deprivation of a typical work week, their snacking resumes. their insulin sensitivity also decreases, which is a warning sign for diabetes. effectively, the benefits of the weekend sleep are canceled out by the following workweek. sleeping in is one approach to recoup sleep debt, but if you've been missing out on sleep for several days in a row, two days of sleeping in may not be enough. you may need several nights of good sleep to fully recover.	if you've been missing out on sleep for several days in a row
are there any types of food that can help improve quality of sleep?	other cherry varieties such as the jerte valley, pico limon, and pico colorado cultivars have also been shown to improve sleep for some people, though with mixed results that may be due to variances in melatonin concentration. kiwifruit is a nutritious addition to your diet. the fruit is a rich source of nutrients such as vitamin c, vitamin e, fiber, and potassium, as well as enzymes and antioxidants with various metabolic benefits. some research suggests that eating kiwifruit before bedtime can increase sleep duration and reduce time spent awake in bed, though this topic has not been extensively studied and additional research is needed.	other cherry varieties
i have read online that different colour coding of the bedroom can have different effects on sleep quality. is this true?	some may also have cultural or emotional associations with certain colors. one study found rooms painted in warm colors were described by participants as exciting and stimulating, while rooms painted in cool colors were seen as spacious and restful. these color associations have the potential to influence mindset at bedtime. as a result, the colors you see before you close your eyes may impact how fast you fall asleep and how well you sleep. personal experiences can change how each person responds to certain colors, and some people may find bedroom colors have no effect on their sleep.	some people may find bedroom colors have no effect on their sleep.
what is the recommended duration of an effective nap?	in fact, researchers have identified a nap paradox, in which many studies find naps provide benefits, while others find napping is associated with illnesses. studies show napping might be particularly helpful for people who cannot sleep during regular nighttime hours, such as those who work rotating schedules or at night. a nap taken before working overnight or during a night shift can reduce sleepiness and improve mental ability and work performance. naps may also reduce the risk of car crashes due to drowsy driving. the ideal nap length depends on an individual's unique situation, as well as what they want from the nap.	depends on an individual's unique situation, as well as what they want from the nap
how do substances like nicotine affect my sleep?	smoking and drinking alcohol can both disrupt your sleep cycle, albeit in different ways. nicotine, like caffeine, is a stimulant that elevates feelings of arousal and wakefulness. this is true of smoking, as well as nicotine patches. quitting smoking is also associated with sleep problems, but these issues typically clear up within a few weeks. by contrast, many people fall asleep more quickly after consuming alcohol, but sleep problems may occur later in the night after the alcohol has been metabolized. electronic devices with screens such as smartphones, tablets, laptops, and televisions emit blue light.	elevates feelings of arousal and wakefulness
i get hungry at night even if i have had a full dinner, so i sometimes eat chips before i go to bed. i read that eating before going to bed is bad for my sleep, so should i just go to bed hungry?	heavy meals and drinking before bed can lead to indigestion, acid reflux, and middle - of - the - night restroom trips that disrupt your sleep. however, going to bed hungry can also upset your stomach and make it hard to fall asleep. find a healthy middle ground by calming your stomach with a light snack, like a piece of fruit or yogurt. cherries, grapes, strawberries, nuts, and oats all have high melatonin content. non - caffeinated herbal teas, especially ones with chamomile or lavender, are another nice way to calm the mind and induce sleep. just make sure to use the restroom before bed!	going to bed hungry can also upset your stomach and make it hard to fall asleep.
how do i know if i am in need of professional sleep therapy?	while many people can benefit from making their own playlists or finding something pre - mixed, others may benefit from a more formal approach. certified music therapists are professionals trained in using music to improve mental and physical health. a music therapist can assess a person's individual needs and create a treatment plan that can involve both listening to and creating music. for more information on music therapy, talk with your doctor or visit the american music therapy association. interest in music's effects on the body continues to grow, and major research programs are dedicated to uncovering new ways that music can benefit health.	talk with your doctor or visit the american music therapy association
do we sleep better after exhausting our body more?	daily exercise contributes to more restful sleep. exercise is also a great reliever of stress and anxiety. try to finish your workout at least 1 hour before bed. vigorous exercise energizes and heats up the body, so leave enough time for you to cool off and calm back down before bed. our minds are being overloaded with stressful information during the pandemic. it's easy to get caught up and overwhelmed by it all. help your mind stay calm and focused by setting a dedicated time to worry and take it all in. then, write down everything that's stressing you out.	daily exercise contributes to more restful sleep.
when should i avoid exercise for better sleep?	there are several strategies you can try to help you sleep through the night. follow a regular sleep schedule every day, even on weekends. avoid napping during the day, especially for longer than 30 minutes and past the late afternoon. adopt a calming bedtime routine to ease you into sleep each night. if you think exercise is keeping you up, switch your exercise routine to the morning to see if that helps. jotting down your thoughts can be especially helpful if you think stressful thoughts are waking you up during the night. get your worries out of your head and onto the paper.	avoid napping during the day, especially for longer than 30 minutes and past the late afternoon
does weight affect sleep quality?	insufficient sleep has been linked to an imbalanced increase in energy intake over expenditure, which leads to a positive energy balance and weight gain. sleep quality may also moderate the relationship between physical activity and feelings of fatigue. this indicates that diet, exercise, and sleep all interact and influence our feelings of energy and our energy balance. some people experience higher energy levels at night, making it difficult to fall asleep and get the rest they need. this can be especially troubling if demands like work or school still require them to wake early, and therefore get insufficient sleep.	may also moderate the relationship between physical activity and feelings of fatigue.
i grind my teeth during my sleep, why is that so?	the grinding usually occurs in clusters of one - second muscle contractions during individual micro - arousals from sleep, and lasts between 3 - 15 seconds each. clenching your jaw or grinding your teeth every once in a while is normal, and usually won't cause damage. however, if it becomes more frequent, it should be addressed and monitored, both in order to maintain your oral health and in order to maintain your sleep health. the actual causes of sleep bruxism are not yet fully understood. however, there are several contributing factors that may lead to someone grinding their teeth at night. people with sleep bruxism often have the condition without knowing it, and only notice because people who regularly co - sleep with them point it out.	usually won't cause damage
how does sleep improve my short-term and long-term memory?	when someone is ill or injured, this inflammatory response may help with recovery, fortifying innate and adaptive immunity as the body works to repair wounds or fight off an infection. studies have found, though, that this inflammation occurs even when a person isn't actively hurt or sick. analysis of the type of cells and cytokines involved in this nighttime immune activity indicates that its role is to strengthen adaptive immunity. just like sleep can help the brain consolidate learning and memory, research suggests that sleep strengthens immune memory. the interaction of immune system components during sleep reinforces the immune system's ability to remember how to recognize and react to dangerous antigens.	sleep strengthens immune memory.
what type of yoga should i do before sleeping?	such exercise, when done at least several hours before bedtime, can help you sleep better at night. since high - activity yoga forms elevate the heart rate, it's best to avoid these practices right before bedtime. poses done before bedtime should encourage the body to relax and sleep. keep in mind that the sleep environment should primarily be used for sleeping ; find another quiet location to do your yoga poses before you go to sleep. be sure you are in a safe space free of any potential hazards. if you have any concerns about your yoga practice, consult a yoga instructor and / or a physician. remember that yoga is not a substitute for medical treatment. in the event of persistent sleep disturbances or other concerns, consult your physician to develop a treatment plan.	encourage the body to relax and sleep.
what really happens if i dont get the optimum number of sleep for a university student?	even now there's a piece of research done recently that indicated it's regarded as masculine to be underslept. this is despite all the scientific evidence proving that a good night's sleep is vital to our short - and long - term health. people who sleep too much are looked down on. people who get the right amount of sleep, well why do you need that much? when i left university, i went into advertising, and i was highly stressed. i used alcohol to get to sleep, and then once i decided i didn't want to drink anymore, i couldn't get to sleep.	i went into advertising, and i was highly stressed
what are good sleep hygiene?	good sleep hygiene describes a set of habits that promote healthy sleep. incorporating these habits into your daily routine can help improve the quality of sleep you get each night. if stress is keeping you up, relaxation methods can help relieve your stress during the day. meditation and yoga can both reduce stress and anxiety. you can also incorporate relaxation techniques into your bedtime routine, such as progressive muscle relaxation, deep breathing exercises, or aromatherapy. if your anxiety is interfering with your quality of life, it may be beneficial to consult a mental health professional.	a set of habits that promote healthy sleep
does the type or quality of mattress matter in obtaining a better sleeping experience?	understanding critical performance criteria can make it easier to select the best mattress for you. edge support is one such factor that can greatly impact the sleep experience, but many shoppers may not immediately take it into account. not only is it worthwhile to consider on its own, but it can also have far - reaching implications that affect other aspects of the mattress'overall performance, including its durability, suitability for sex, and ease of movement. we'll provide an in - depth overview of edge support, including defining what it is, explaining the role of materials and construction, and breaking down how our testing lab analyzes mattress performance in this area.	edge support
does exercise help me sleep better?	however, recent studies have found that exercise at night may not have such a negative impact on sleep or morning grogginess, and may even increase the proportion of restorative deep sleep. the 2013 national sleep foundation sleep in america poll also found no evidence that evening exercise was harmful to sleep, and updated sleep hygiene recommendations to reflect the beneficial effects of exercise for sleep at any time of day. exercise helps calm anxiety and depression, and helps the mind relax in preparation for sleep. it also provokes a sharp rise in body temperature followed by a gradual cooling, which mimics the natural fluctuations of the circadian rhythm and paves the way for sleep.	exercise helps calm anxiety and depression, and helps the mind relax in preparation for sleep.
what are the sleep stage	noise has a major impact on sleep. exposure to too much noise during sleep has immediate effects while we are sleeping, which leads to short - term issues the next day, and over time may result in long - term mental and physical consequences. noises at night might wake you up, and a fragmented night's sleep is less refreshing. even noises that don't wake you up have subconscious effects on sleep by changing the time we spend in certain sleep stages. sleep stages are the different types of sleep we cycle through each night, ranging from lighter stages ( 1 and 2 ) to deep ( slow wave ) sleep and rapid eye movement ( rem ).	the different types of sleep we cycle through each night
can i take multiple naps rather than sleeping through the night?	there are several strategies you can try to help you sleep through the night. follow a regular sleep schedule every day, even on weekends. avoid napping during the day, especially for longer than 30 minutes and past the late afternoon. adopt a calming bedtime routine to ease you into sleep each night. if you think exercise is keeping you up, switch your exercise routine to the morning to see if that helps. jotting down your thoughts can be especially helpful if you think stressful thoughts are waking you up during the night. get your worries out of your head and onto the paper.	avoid napping during the day, especially for longer than 30 minutes and past the late afternoon
how do i get better sleep being a night owl?	there is also a link between depression and being a night owl. some researchers have compared having a late chronotype to living with a chronic form of jet lag. the tension between their natural sleep - wake cycles and society's demands can create real consequences for night owls, including an increased risk of health problems, mood disturbances, and poor performance in work and at school. your chronotype is largely genetic, but your age, environment, and activity level can all influence it. for example, in one study, night owls were able to shift their sleep cycle forward by as much as two hours through a handful of ordinary lifestyle changes.	shift their sleep cycle forward by as much as two hours through a handful of ordinary lifestyle changes
what time should i stop drinking caffine for me to fall asleep better?	aim to schedule your last meal at least three hours before bed. this way, your digestion won't disturb your sleep, but you won't go to bed starving, either. going to bed dehydrated can lead to shorter or lower - quality sleep. drinking more water during the day may reduce your hunger cravings, while also making it easier to sleep at night. be careful with your caffeine and alcohol consumption, too. caffeine may decrease your appetite, but it disrupts your sleep. alcohol also disrupts sleep, in addition to negatively impacting your metabolism and causing nutritional deficiency. try to avoid foods high in sugar and empty calories like junk foods.	at least three hours before bed
how do i encourage other people in my family to sleep better?	music can also promote sleep by becoming a healthy bedtime habit. many people who struggle with insomnia do so because stressful and worrisome thoughts keep them up at night. this stress wakes the body up, delaying sleep. by listening to music, the mind has something else to focus on. with time, the consistent practice of listening to music at bedtime becomes more effective as the brain positively associates music and sleep. certain types of music are better for sleep than others. longer songs or playlists may also be helpful, since they give the body more time to relax into sleep.	by becoming a healthy bedtime habit
why do we need to sleep?	according to the cdc, adults need at least seven hours of sleep every night for optimal health. this means spending nearly a third of your life sleeping. with so much time spent snoozing, it's natural to wonder why the process of sleep is so critical and how it works. we'll break down the basics, including the importance of sleep, what happens in your brain when you drift off, how your body knows when it's time for bed, and ways you can improve your chances of getting a great night's rest. scientists and medical experts are still hard at work unraveling the mysteries of sleep.	adults need at least seven hours of sleep every night for optimal health
i often fall asleep at an inappropriate time, e.g. when attending lessons or meeting. it's embarrassing but how to solve this problem?	this light can suppress the production of melatonin, the sleep hormone, and make falling asleep more difficult. recent studies suggest that using screen devices for two hours or longer in the evening can impact your sleep. stress due to work, family life, and other factors has been linked to trouble relaxing at bedtime. whether you enjoy meditating, a bedtime yoga routine, or a warm evening bath, finding ways to alleviate stress may help you fall asleep more easily. if a racing mind is keeping you up at night, it may help to jot down your thoughts on paper so you can mentally shelve your obligations until the morning.	suppress the production of melatonin, the sleep hormone, and make falling asleep more difficult.
how can i prevent having nightmares?	it's unclear if the meal itself leads to nightmares or if there's something else that explains this relationship. understanding the cause of nightmares is an important step to reducing their frequency. most importantly, don't be afraid to ask for help if you're experiencing nightmares. it's important to talk to a health professional if nightmares are happening more than once a week or if they're affecting your mood and daytime activities. there are several treatments available for recurrent nightmares, so don't suffer in silence.	understanding the cause of nightmares is an important step to reducing their frequency
