how does sleep affect my mood for the day?	sleep can also affect mood and perception, including how a person perceives their skin and overall appearance. women who sleep well tend to be more satisfied with their appearance than women who do not sleep well. this satisfaction may be due in part to how they are perceived in the world. studies have demonstrated that someone who is sleep deprived is perceived as less attractive. as a result of sleep deprivation, they might have dark circles under their eyes, swollen eyelids, and a puffy face. there is also a correlation between appearing tired and appearing sad.	sleep can also affect mood and perception, including how a person perceives their skin and overall appearance.
what is the optimum nap duration?	napping can be refreshing if you're short on sleep while traveling, but it's important not to go overboard with naps. if you nap for too long, you may wake up even groggier. long naps or naps in the late afternoon or evening can also throw off your sleep schedule. in order to get the benefits of naps without many downsides, try to nap for less than 30 minutes and a maximum of 60 minutes. the best time to nap is usually shortly after lunch, and naps later in the day should be avoided.	less than 30 minutes and a maximum of 60 minutes
i have an irregular sleep and wake cycle but i am able to get 7 hours (accumulative) sleeping time per day including napping time.  do i have to adjust my sleep and wake cycle?	irregular sleep - wake disorder, which is most common in those with neurological disorders such as dementia or brain injury, causes people to lack a clear sleep - wake cycle. while they may get enough sleep, this sleep is obtained over the course of at least three sleep periods. treatment, if considered necessary, usually involves melatonin and lifestyle changes such as physical activity. practicing good sleep hygiene can stabilize and improve your sleep schedule. synchronizing the sleep schedule with natural daylight patterns and keeping it consistent throughout the week may improve sleep and overall quality of life.	they may get enough sleep, this sleep is obtained over the course of at least three sleep periods.
what is the minimum amount of sleep i need?	most research has focused on the mental effects of rem sleep. rem has physical impacts, too, and seems to protect against obesity. also, emerging evidence suggests that missing the rem sleep period near the end of the night may increase next - day appetite. adults need at least seven hours of sleep every night. rem sleep should make up around 20 % to 25 % of a person's total time asleep. that said, experts usually give recommendations for overall sleep time rather than for rem sleep in particular, as the body tends to self - regulate to maintain a balanced level of sleep stages.	at least seven hours of sleep every night
does tracking my sleep cycle lead me to be more self-aware of myself?	tracking my own sleep and movement is incredibly helpful in informing my day's activities. for example, i use data from my wearable to determine if i should push a little harder during my daily workout, or if i need to take it easier. plus, i truly appreciate the reminder to start winding down for sleep. i wondered if my daughter's experience would be the same. my daughter is like a typical nine - year - old, but with more energy. she's bright and bubbly some days, crabby and moody others, i asked if she thought it'd be fun if we strapped a wearable to her wrist 24 / 7.	i truly appreciate the reminder to start winding down for sleep
how long should i sleep so that i can be prepared for a competition the following day?	the office of the army surgeon general recommends that soldiers sleep at least seven hours per night, although only a minimum of four hours is required during field training exercises. in preparation for times when sleep may be hard to achieve, such as during a combat mission or overnight operation, soldiers are recommended to get at least nine hours of sleep ahead of time. while not a long - term solution to the impacts of chronic short sleep, banking sleep in this way may provide immediate, next - day effects which can improve soldiers'effectiveness during a mission. getting more sleep than usual ( such as 10 hours ) improves alertness and performance during a short period of sleep deprivation, and napping has been shown to lower heart rate and improve memory in athletes.	at least nine hours of sleep ahead of time.
if alcohol makes me sleepy, why is it bad for sleep?	instead of tossing and turning in bed, it's better to get up, do something relaxing in a quiet and dim setting ( without using your cell phone or other electronic devices ), and then try to go back to bed. the reason experts advise this approach is that it's important to associate your bed with sleep. staying in bed while struggling to sleep can do the exact opposite, linking your bed with a feeling of frustration. a drink or two can be relaxing, inducing drowsiness that makes it easier to initially fall asleep. the problem is that the quality of sleep declines considerably after drinking alcohol.	the quality of sleep declines considerably after drinking alcohol.
is using my phone before sleeping bad?	this includes only taking the prescribed dose and doing so at the right time to ensure the most help for your sleep and reduce risks of grogginess the next morning. while this step may seem obvious, a study found widespread improper use of common prescription sleep medication. it was discovered that many people took too high of a dose, took the pill too late at night, and / or continued taking the drug for longer than intended. as you take the sleep medication, be on the lookout for warning signs of adverse effects and talk to your doctor if you detect them.	ensure the most help for your sleep and reduce risks of grogginess the next morning.
if blue light from screens is the reason for disturbing the sleep cycle, will wearing blue light glasses combat the negative effects on sleep?	smartphones, televisions, and other devices with screens also produce artificial blue light that can be detrimental to sleep, even if you use dimmer nighttime screen settings. keep your bedroom light levels as low as possible if you like to read in bed before sleep. dimmer lights will help you fall asleep more easily. another good rule - of - thumb is to avoid using screen devices - including televisions - in your bedroom. depending on your sleep preferences, you may enjoy the close body contour of memory foam, the gentle support of latex, or the springy feel of a mattress with coils.	artificial blue light that can be detrimental to sleep
how can i improve my sleep	other ways to improve your sleep hygiene include keeping a consistent evening routine, avoiding electronics before bedtime, and getting plenty of exercise during the day. drinking alcohol and taking sedatives relax muscles in the airway, which may increase snoring and sleep apnea symptoms. it takes about two hours to metabolize one alcoholic drink, so people who drink more than one drink may need to stop drinking several hours before bedtime to avoid effects on sleep and snoring. some people who take medication with sedating side effects do so at night to avoid daytime drowsiness or to help them sleep.	keeping a consistent evening routine, avoiding electronics before bedtime, and getting plenty of exercise during the day
does one's water intake affect sleep quality?	it is not uncommon to feel thirsty right before going to bed. in fact, a study in mice showed that the tendency to drink more in the evening might be a natural part of the sleep - wake cycle, in order to prevent becoming dehydrated overnight. although mild dehydration does not appear to directly impact sleep for otherwise healthy people, staying hydrated supports systems in the body that do impact your sleep. water is an essential nutrient for the human body, helping to remove waste, lubricate the joints, regulate body temperature, and cushion sensitive tissues. although recommendations vary, the general consensus is that adults should drink between 2. 5 and 4. 5 liters of water a day depending on their body weight and level of activity.	helping to remove waste, lubricate the joints, regulate body temperature, and cushion sensitive tissues
how often should i exercise in a week to have a better sleep?	explore relaxation techniques that can relieve your stress. meditation, deep breathing, and yoga, can all help. fill your bedtime routine with calming activities, like a warm bath or reading a book. if your stress and thoughts interfere with your quality of life, speak to a doctor or therapist. exercise daily to enjoy more restful sleep. regular exercise can also help relieve stress. if you prefer a vigorous workout, schedule your exercise for earlier in the day to prevent it from disrupting your sleep. if you can only exercise at night, opt for low or moderate - intensity exercises like walking or yoga.	exercise daily
if i sleep for five hours and have four 30 minute naps in the day, will it add up to the 7 hours of sleep i need?	short naps may help you feel more rested and finish your work day strong. most adults need approximately seven to nine hours of sleep each night. however, activities such as work, commuting, and socializing have been shown to reduce the overall amount of time people spend asleep, resulting in a sleep debt. sleep debt is the difference between how much sleep a person needs and how much they actually receive. napping is one way to reduce your sleep debt and its negative impacts. for example, a 10 - minute power nap during the day may be enough to help you fight fatigue and sleepiness for up to two hours after your nap.	most adults need approximately seven to nine hours of sleep each night
is there any different need between gender on sleep?	have you ever wondered how whales can sleep without drowning, or why bats sleep upside down? all animals need sleep, but animal sleep patterns are as varied as the animal kingdom itself. mammals sleep to save their energy and restore mental and physical energy. the amount of sleep a mammal needs depends on several factors, including age, body size, environment, diet, and the safety of its sleep site. whether a mammal lives on land or in the sea can also affect how much sleep it needs. different mammals spend different amounts of time in non - rem sleep and rem sleep.	different mammals spend different amounts of time in non - rem sleep and rem sleep.
how can i improve my sleep quality	other ways to improve your sleep hygiene include keeping a consistent evening routine, avoiding electronics before bedtime, and getting plenty of exercise during the day. drinking alcohol and taking sedatives relax muscles in the airway, which may increase snoring and sleep apnea symptoms. it takes about two hours to metabolize one alcoholic drink, so people who drink more than one drink may need to stop drinking several hours before bedtime to avoid effects on sleep and snoring. some people who take medication with sedating side effects do so at night to avoid daytime drowsiness or to help them sleep.	keeping a consistent evening routine, avoiding electronics before bedtime, and getting plenty of exercise during the day
is it good to do yoga before sleeping?	such exercise, when done at least several hours before bedtime, can help you sleep better at night. since high - activity yoga forms elevate the heart rate, it's best to avoid these practices right before bedtime. poses done before bedtime should encourage the body to relax and sleep. keep in mind that the sleep environment should primarily be used for sleeping ; find another quiet location to do your yoga poses before you go to sleep. be sure you are in a safe space free of any potential hazards. if you have any concerns about your yoga practice, consult a yoga instructor and / or a physician. remember that yoga is not a substitute for medical treatment. in the event of persistent sleep disturbances or other concerns, consult your physician to develop a treatment plan.	it's best to avoid these practices right before bedtime
how does coffee affect sleep	unfortunately, these will likely make your sleep worse. be thoughtful about your caffeine intake during finals. limit yourself to 400 mg per day, and stop having any at least eight hours before bedtime. studies show that coffee has the ability to disrupt sleep even when ingested six hours before bed. nicotine and alcohol also worsen sleep quality. instead, indulge in your favorite healthy foods to keep your energy levels up and your mood balanced. if you can, prioritize your sleep during finals week. your grades will thank you for it!	coffee has the ability to disrupt sleep even when ingested six hours before bed.
why do i still feel tired after sleeping?	your bed should only be used for sleep and sex. at night, follow a bedtime routine to help you unwind from the day. performing the same set of activities every night also signals to your brain that it's time to sleep. stop using your electronics at least 1 hour before bed, and turn down the lights. instead, enjoy a relaxing activity like reading a book or taking a bath. listen to something calming, like a guided meditation or gentle music. stress makes sleep difficult, pandemic or not. regular exercise, journaling, and taking a break from the news may help relieve stress and improve your sleep.	stress makes sleep difficult, pandemic or not.
why are people not conscious of the awaking session during sleep?	for example, people with sleep apnea experience brief partial awakenings due to lapses in breathing during the night. sleep duration for these individuals often appears to be normal, but because they experience interruptions in sleep, they suffer from the effects of sleep deprivation. evidence suggests that getting continuous sleep serves critical roles in the support of our brain and body functioning and that continuous sleep is at least as important as sleep duration. a research study found that participants who had greater sleep continuity performed better on cognitive tasks the next day, an effect that was independent of the total amount of sleep.	because they experience interruptions in sleep, they suffer from the effects of sleep deprivation
what are the factors affecting sleep	theories about sleep for men versus women abound, and many wonder what the science says. research has shown that sex and gender differences do influence sleep. hormones, anatomy, and other physiological differences between men and women can affect the way they sleep and the likelihood of experiencing certain sleep problems. women and men also face different societal and familial expectations, with corresponding demands on time and mental energy. although sleep patterns are influenced by a myriad of factors, it's helpful to know how sex and gender may play a role. women tend to sleep for longer and spend more time in the restorative deep sleep stage compared to men.	hormones, anatomy, and other physiological differences between men and women
effects of sleep deprivation	multiple studies have found that pulling an all - nighter causes impairment that is comparable to being drunk. researchers found that after 24 hours of sleep deprivation, a person's mental performance is equivalent to that of someone who has a blood alcohol content ( bac ) of 0. 10 %, well over even the highest legal limit for driving in the united states ( 0. 08 % ). another major effect of total sleep deprivation is daytime sleepiness. the brain and body are used to having a period of rest, and when forced to miss this time for recovery, it's natural to have episodes of drowsiness. sleep deprivation can also cause microsleeps, which involve briefly dozing off for a few seconds.	can also cause microsleeps, which involve briefly dozing off for a few seconds.
what is the last timing to drink coffee before coffee starts affecting my sleep quality?	aim to schedule your last meal at least three hours before bed. this way, your digestion won't disturb your sleep, but you won't go to bed starving, either. going to bed dehydrated can lead to shorter or lower - quality sleep. drinking more water during the day may reduce your hunger cravings, while also making it easier to sleep at night. be careful with your caffeine and alcohol consumption, too. caffeine may decrease your appetite, but it disrupts your sleep. alcohol also disrupts sleep, in addition to negatively impacting your metabolism and causing nutritional deficiency. try to avoid foods high in sugar and empty calories like junk foods.	at least three hours before bed
as a light sleeper, how do i create the optimal environment for sleep?	if you often wake up at night, whether from the headlights of a passing car or the noise of a family member in the hallway, you might be a light sleeper. light sleepers might be frustrated by having sleep interrupted by factors outside of their control. plus, getting high - quality, uninterrupted sleep is important to overall well - being. sleep affects nearly all aspects of health, from your mood and metabolism to your brain and your bones. if you are a light sleeper, it is beneficial to understand what is waking you up and figure out what you can do to sleep more soundly through the night.	to sleep more soundly through the night
can i communicate with someone as they sleep talk?	your partner will likely appreciate you being supportive as they navigate their symptoms. it can be embarrassing for people to find out they have been talking in their sleep, especially if the content is graphic or offensive. if you notice other concerning symptoms, encourage sleep - talking family members to see a doctor. if your sleep talking is disturbing you or your partner's sleep, or, if you are concerned it is a sign of something more serious, make an appointment with your doctor. let them know if you experience additional symptoms, such as screaming, violent thrashing or kicking during your sleep, or if you seem afraid. your doctor may order an overnight sleep study, called polysomnography, to rule out another sleep disorder like rem sleep behavior disorder or night terrors. in many cases, sleep talking is harmless. but if you have concerns, talk to your doctor or sleep specialist.	your partner will likely appreciate you being supportive as they navigate their symptoms
is sleeping important	even an over - the - counter antihistamine like diphenhydramine should not be used without consulting a doctor. their effectiveness is unreliable, and there's not enough evidence to be sure that sleep aids don't adversely affect birth outcomes. don't hesitate to seek professional advice for any change in sleep habits, no matter how small. while sleeping troubles can often be managed at home, sometimes a medical expert is needed to guide care or assess for something serious. staying healthy is especially important during pregnancy, and good health starts with a good night's sleep.	staying healthy is especially important during pregnancy, and good health starts with a good night's sleep.
should i drink milk before i sleep?	drinking milk before bed does not appear to have documented negative side effects in most people. some people, however, might want to avoid milk. for example, people who have a dairy allergy, are lactose intolerant, or have irritable bowel syndrome with symptoms that are worsened by dairy probably should not use milk to promote sleep. if you are avoiding milk, you may want to opt for non - dairy sleep - inducing foods instead. some may worry that drinking milk before bed could promote weight gain. however, research suggests a glass of milk at night could help promote fitness.	drinking milk before bed does not appear to have documented negative side effects in most people
what should be the optimal length of nap?	napping can be refreshing if you're short on sleep while traveling, but it's important not to go overboard with naps. if you nap for too long, you may wake up even groggier. long naps or naps in the late afternoon or evening can also throw off your sleep schedule. in order to get the benefits of naps without many downsides, try to nap for less than 30 minutes and a maximum of 60 minutes. the best time to nap is usually shortly after lunch, and naps later in the day should be avoided.	usually shortly after lunch
why does scrolling through social media affects sleep quality	that said, no studies have been conducted yet on how sleeping nude affects skin. sleeping naked may positively impact male fertility, though it hasn't been directly studied. research suggests that wearing tight - fitting underwear increases the temperature of the scrotum, which can decrease sperm vitality and count. for this reason, wearing boxers versus tighter fitting underwear may impact the concentration of sperm in men. additionally, there is evidence that scrotal cooling directly impacts sperm health and motility. sleeping naked can help you keep your body temperature cooler. although research on sleeping naked is needed to draw valid conclusions, past research suggests the cooling associated with sleeping nude might increase sperm health.	may positively impact male fertility
does exercise late at night affect my sleep?	however, recent studies have found that exercise at night may not have such a negative impact on sleep or morning grogginess, and may even increase the proportion of restorative deep sleep. the 2013 national sleep foundation sleep in america poll also found no evidence that evening exercise was harmful to sleep, and updated sleep hygiene recommendations to reflect the beneficial effects of exercise for sleep at any time of day. exercise helps calm anxiety and depression, and helps the mind relax in preparation for sleep. it also provokes a sharp rise in body temperature followed by a gradual cooling, which mimics the natural fluctuations of the circadian rhythm and paves the way for sleep.	may even increase the proportion of restorative deep sleep.
does sleeping with socks improve quality of sleep	next time you are picking out what to wear to bed, consider adding socks. many people anecdotally claim that sleeping in socks helps them sleep better and scientific research suggests they might be onto something. learn about how socks may impact sleep and which socks to choose if you want to try this potentially sleep - boosting method. research suggests that wearing socks to bed can help people not only fall asleep faster, but sleep longer and wake up fewer times throughout the night. one study found that young men wearing socks fell asleep 7. 5 minutes faster, slept 32 minutes longer, and woke up 7. 5 times less often than those not wearing socks.	sleeping in socks helps them sleep better
what is considered as good sleep?	dreams appear to be an important part of normal, healthy sleep. at the same time, though, nightmares can disrupt sleep and even affect a person during their waking hours. given that virtually everyone has dreams, both good and bad, it's natural to wonder how dreaming affects sleep quality, whether nightmares are bad for sleep, and how to avoid bad dreams. dreaming is a normal part of healthy sleep. good sleep has been connected to better cognitive function and emotional health, and studies have also linked dreams to effective thinking, memory, and emotional processing. in this way, many experts believe dreaming is either a reflection of or a contributor to quality sleep.	connected to better cognitive function and emotional health
what is obstructive sleep apnea?	while there is no cure for canine narcolepsy, the condition is not life - threatening and does not worsen with age. not all dogs require treatment for their narcolepsy, but those with severe symptoms may be treated with anti - cataplectic medication. obstructive sleep apnea is a sleep breathing disorder that occurs in many mammals, including humans and dogs. it occurs when relaxed tissue and muscles block the airway, causing short breathless periods called apneas. in both humans and dogs, some of the most common symptoms are excessive daytime sleepiness and loud snoring or choking noises during sleep. dogs with extremely short muzzles, like bulldogs, are more prone to sleep apnea than other breeds.	a sleep breathing disorder
covid has forced my whole family to stay at home all day and i only have free time after 10pm to do my own things like schoolwork and self-care, but i can't sleep past 7 am as my family will wake me up and i'm constantly tired as a result. do you have any sleep tips to help me better the problem?	but the consequences have spread far and wide, posing diverse and significant barriers to sleep. covid - 19 is the disease caused by infection with the sars - cov - 2 coronavirus. research has shown that people with covid - 19 frequently have sleeping problems. symptoms like cough and fever as well as the use of some medications can interfere with sleep. sleep disruptions have been seen in people with severe covid - 19 as well as non - hospitalized patients. additionally, many people with long covid, which involves persistent health effects months after infection, describe having lasting sleep difficulties. social distancing, school closures, quarantines, and working - from - home all bring profound changes to normal routines for people of all ages and walks of life.	social distancing, school closures, quarantines, and working - from - home
