how much sleep is too much sleep?	even now there's a piece of research done recently that indicated it's regarded as masculine to be underslept. this is despite all the scientific evidence proving that a good night's sleep is vital to our short - and long - term health. people who sleep too much are looked down on. people who get the right amount of sleep, well why do you need that much? when i left university, i went into advertising, and i was highly stressed. i used alcohol to get to sleep, and then once i decided i didn't want to drink anymore, i couldn't get to sleep.	a good night's sleep is vital to our short - and long - term health
can i take afternoon naps after 3pm?	while dietary needs and responses to food can vary from person to person, it may help to avoid large and heavy meals that can increase the urge to doze off after eating. individuals can take note of any foods or types of meals, such as high - fat or high - carb meals, that seem to have the biggest effect on their postprandial sleepiness. being mindful about alcohol consumption may also help prevent dips in alertness after meals. another strategy for avoiding the post - lunch dip is to take a quick nap. several research studies have found that people who take naps of 15 to 45 minutes shortly after a meal feel less sleepy and more alert.	people who take naps of 15 to 45 minutes shortly after a meal feel less sleepy and more alert
how does sleep affect relationship with others?	this may explain studies that have found an elevated risk of workplace accidents among women working night shifts. sleep studies have traditionally focused on individuals, but in everyday life, many adults sleep with a partner. whether their partner is a man or a woman, this sleeping arrangement can affect nightly rest. when sleep is analyzed objectively, studies have generally found that people sleep better alone than with a partner. but when surveyed, most people say that their sleep is subjectively improved when they are next to their partner. for heterosexual or same - sex couples, sharing the bed with a partner can communicate a sense of calm and safety that is conducive to sleep.	this sleeping arrangement can affect nightly rest.
how does my sleep affect my mood?	sleep can also affect mood and perception, including how a person perceives their skin and overall appearance. women who sleep well tend to be more satisfied with their appearance than women who do not sleep well. this satisfaction may be due in part to how they are perceived in the world. studies have demonstrated that someone who is sleep deprived is perceived as less attractive. as a result of sleep deprivation, they might have dark circles under their eyes, swollen eyelids, and a puffy face. there is also a correlation between appearing tired and appearing sad.	can also affect mood and perception, including how a person perceives their skin and overall appearance.
what is a good sleeping posture?	the best sleep position is one that promotes healthy spinal alignment from your hips all the way to your head. what that looks like for you depends on your personal health situation and what you find comfortable. having said that, there are some positions that are considered healthier than others. specifically, sleeping on the side or back is considered more beneficial than sleeping on the stomach. in either of these sleep positions, it's easier to keep your spine supported and balanced, which relieves pressure on the spinal tissues and enables your muscles to relax and recover.	one that promotes healthy spinal alignment from your hips all the way to your head
should i take melatonin supplements	melatonin supplements can be purchased over - the - counter and used as a short - term sleep aid. in some cases, a doctor may recommend prescription medication to help you stay asleep. certain medications can have serious side effects and should only be used as prescribed. being a light sleeper can be frustrating, but there are steps you can take to sleep more deeply. if you still feel tired after taking steps to improve your sleep hygiene and bedroom environment, consult your doctor. they can provide additional recommendations based on your personal medical history, or refer you to a specialist to determine if an underlying condition is contributing to your sleep troubles.	can be purchased over - the - counter and used as a short - term sleep aid.
is melatonin pills effective in improving sleep?	several studies have shown melatonin supplements can significantly improve overall sleep times by 25 minutes to 48 minutes, on average, for children with these conditions. however, there haven't been enough studies of melatonin in children for experts to determine an official recommended dosage or any potential long - term safety risks. since melatonin is a hormone, it's possible that taking supplemental melatonin could affect other aspects of hormone development in children, but further research is needed. if your child is having sleep problems, experts recommend consulting your doctor before giving them melatonin. research indicates that for half of the cases where melatonin was used to treat pediatric insomnia, better sleep habits were just as effective at relieving the child's sleep problems.	melatonin supplements can significantly improve overall sleep times by 25 minutes to 48 minutes
what does lack of sleep do?	a lack of sleep also increases irritability and risk for anxiety and depression. physically, a lack of sleep increases the risk for many medical concerns, including type 2 diabetes, high blood pressure, kidney disease, and stroke. while quality sleep has positive effects specifically on athletic performance, a lack of sleep is detrimental to performance. evidence shows that more sleep, or extended sleep, can benefit athletes, their recovery, and their performance. recommendations for athletes range between seven and nine hours nightly. elite athletes are encouraged to get at least nine hours of sleep nightly and to treat sleep with as much importance as athletic training and diet.	increases irritability and risk for anxiety and depression
how long should i condition myself before going to sleep?	you may also want to refrain from taking sleep - promoting medication before doing activities that require concentration. many people experience episodes of microsleep as a natural consequence of staying up late one night. although they are not a substitute for proper sleep, microsleeps may lead to a brief improvement in performance. however, it is important to talk to your doctor if you think your microsleep episodes might be due to a sleep disorder. if you find yourself having trouble receiving the recommended seven or more hours of sleep each night or experiencing excessive daytime sleepiness, make an appointment with your doctor. they can help you identify and work to treat any underlying sleep disorders or other medical issues contributing to your sleep problems.	seven or more hours of sleep each night
will certain fragrence (e.g. lavender fragrance) be helpful for our sleep or will it impair some aspects of our sleep?	anyone with sleeping problems should talk with a doctor, and unless directed by a health professional, aromatherapy should not replace other treatments for insomnia or sleep disorders. among essential oils, few have been studied as much as lavender. lavender has been associated with improved sleep in multiple research studies, including in some people with insomnia. the smell of lavender has calming effects on heart rate and blood pressure as well as mood. in a study of people exposed to lavender before bed, deep sleep increased, leading to feeling more refreshed in the morning. roses have a reputation for their appealing fragrance, and rose essential oils have shown potential as aromatherapy for sleep.	improved sleep in multiple research studies, including in some people with insomnia.
how long should i sleep for?	it may be time for a new mattress if you begin to experience sleep - related aches and pains, especially if you have noticed that your mattress is sinking or sagging in certain places. you may also think about replacing your mattress if you want a larger mattress because you are moving to a bigger bedroom or are planning to start sharing a bed with a partner. a good mattress lasts about 7 to 10 years, although certain types of mattresses are more prone to wear and tear than others. some innerspring mattresses may wear out after only five years of use, while latex models tend to last the longest.	about 7 to 10 years
how can utilizing a digital wearable positively affect my sleep?	using a wearable can help us pay attention and make small adjustments to daily practices, like sticking to a bedtime routine. these adjustments can enormously impact our moods, attitudes, and cognitive function. using a wearable has helped me gain insight into and improve my sleep routines. my experience prompted me to wonder, if sleep - tracking wearables help adults make positive lifestyle adjustments, would sleep tracking be beneficial for children, too? as the editor - in - chief of sleep foundation, i eat, breathe, and sleep sleep! for this reason, i felt excited to see how a sleep - tracking wearable might impact my nine - year - old daughter.	helped me gain insight into and improve my sleep routines
can i split up my sleep into segments so i don't have to sleep for continuously 8 hours at night?	sleep latency - the time it takes to fall asleep - may also increase. some studies suggest that, beginning in middle age, the average person loses 27 minutes of sleep per night for each subsequent decade. these decreases in sleep quality and duration are tied to the body's internal timekeeping systems. the body cannot process circadian signals as efficiently, which in turn may cause older people to go to bed and wake up at earlier times. our sleep architecture also changes as we age. a normal sleep cycle is divided into four stages. these include two stages of light non - rapid eye movement ( nrem ) sleep, one stage of heavy or slow - wave nrem sleep, and a final stage of rapid eye movement ( rem ) sleep before the cycle begins again.	a normal sleep cycle is divided into four stages.
can i exercise before i sleep	both aerobic exercise ( like cardio and running ), as well as resistance exercise ( like weightlifting ) can improve sleep quality. any amount of movement may improve sleep, although younger people usually require more exercise than older people to see the same benefits. usually, exercise in the afternoon or early evening helps with sleep. exercise done just before sleep will increase stress hormones, which can worsen sleep problems. working out can also reduce the risk of sleep problems, like insomnia, obstructive sleep apnea ( osa ) and restless leg syndrome ( rls ). multiple studies have shown that exercise can reduce pre - sleep anxiety and improve sleep quality in people with insomnia.	exercise done just before sleep will increase stress hormones, which can worsen sleep problems.
is there a way of traning myself to gain more rem sleep within a limited sleep duration?	for example, one person might sleep text during rem sleep while acting out a dream, because they have rem sleep behavior disorder. another person might sleep text during a confusional arousal, because they hear a text alert while in a state between sleep and wakefulness and reply to the message. regardless of when in the sleep cycle sleep texting occurs, certain factors might make its occurrence more likely. although the causes of texting while asleep are not yet certain, existing research on parasomnias in general suggests there are multiple actions a person can take to reduce or prevent parasomnias from occurring.	one person might sleep text during rem sleep while acting out a dream
how does late night snacks affect my overall sleep?	late - night snacks can also disrupt your sleep, particularly if they have a high fat or sugar content. when you exercise, your body temperature rises to give you energy. for some people, exercising at night has no impact on their sleep. for others, the energy boost from exercise can make it harder to settle into sleep. if you nap too long during the day, it can reduce your sleep drive later that night, making it harder to fall and stay asleep. a short, 20 - to 30 - minute power nap can give you a boost, but anything longer than that can lead to interrupted sleep.	can also disrupt your sleep, particularly if they have a high fat or sugar content
how to treat insomia	treatment for sexsomnia depends on the underlying cause. for people whose sexsomnia is related to another parasomnia, being prescribed a benzodiazepine may be helpful. sexsomnia associated with other sleep disorders is usually relieved by treating the underlying problem, such as the use of continuous positive airway pressure ( cpap ) machine or a mandibular advancement device for obstructive sleep apnea. cases of sexsomnia caused by seizures respond well to anticonvulsant therapy. as sexsomnia appears to be caused by a wide range of conditions, your doctor may prescribe treatment options related to your unique circumstances. they may also suggest that you make lifestyle changes to avoid potential triggers and take steps to ensure your safety and the safety of others in your home until the condition is under control.	depends on the underlying cause
what is the best way to reduce the frequency of night time wake-ups?	nicotine and caffeine are both stimulants that can keep you awake. avoid heavy meals and alcohol as these can disrupt your sleep in the middle of the night. in the hour before bedtime, avoid artificial light from electronics, including tvs, cell phones, and computers. these lights can stimulate the brain and keep you awake longer. instead, try a quiet and relaxing activity. possibilities include a warm bath, meditation, reading, or listening to gentle music. if you find yourself drooping midday, consider taking a power nap. napping at work for no longer than 10 to 20 minutes can give you the alertness boost you need to perform well. positive changes to your sleep habits won't happen overnight. with patience and practice, you'll find which sleep routines work best for your body and health. when you achieve better quality and quantity sleep, you can feel your best and improve your productivity at work.	avoid heavy meals and alcohol
does screentime before sleep affect my time to fall asleep?	we'll cover a few ways you can modify your tv habits to improve your sleep hygiene. screen time right before bed can detract from the quality of your sleep, but that doesn't mean you can't watch tv at night. watching tv earlier is less likely to impact your sleep duration or sleep quality. try shifting your nightly tv watching habit to an earlier time. take small steps at first if you're dealing with a deeply ingrained habit. start by turning the tv off 15 minutes before you want to fall asleep, then increase that time to 30 minutes, 60 minutes, and longer.	can detract from the quality of your sleep
does polyphasic sleep actually work?	anecdotal reports from followers of polyphasic sleep schedules often include claims of increased productivity, alertness, and ability to learn and retain information. credible evidence to support these claims is lacking, however. it may be that polyphasic sleep schedules feel more productive simply because the sleeper has more time, rather than more energy, to get tasks done. if you are only sleeping for three hours a day, that leaves 21 hours to complete tasks. polyphasic sleep schedules may work better than monophasic sleep schedules for some people with a nontraditional work schedule, such as shift work or on - call work.	polyphasic sleep schedules may work better than monophasic sleep schedules
is nap a friend or foe?	we will continue to monitor and revise this article as new literature is published on napping. a nap is a short period of sleep, usually taken during the day. one - third of american adults nap. many swear by napping as an effective way to relax and recharge, while others find naps unhelpful and disruptive to their sleep. not all naps are created equal, and many factors impact how helpful naps can be. by understanding the role of napping, you can learn to take effective naps that support your body's internal clock and maintain your energy level throughout the day.	a nap is a short period of sleep, usually taken during the day
can we make up for sleep at weekends after deprivation in weekdays?	people sleep during the day for various reasons, including insufficient sleep, shift work, and general fatigue. if you've had a restless night, then a daytime nap can help you recharge. nearly 30 % of american adults receive less than 6 hours of sleep each night, so it's not uncommon for people to try and make up for this deficit with daytime napping. for shift workers with atypical schedules, daytime sleeping is often essential. around 15 million american adults work night shifts, and nearly 19 % work at least 48 hours per week. shift workers and people working long hours often rely on sleeping during the day to negate some of the effects of sleep deprivation.	people sleep during the day for various reasons, including insufficient sleep, shift work, and general fatigue.
how do i reduce the number of times i wake up during sleep?	nicotine and caffeine are both stimulants that can keep you awake. avoid heavy meals and alcohol as these can disrupt your sleep in the middle of the night. in the hour before bedtime, avoid artificial light from electronics, including tvs, cell phones, and computers. these lights can stimulate the brain and keep you awake longer. instead, try a quiet and relaxing activity. possibilities include a warm bath, meditation, reading, or listening to gentle music. if you find yourself drooping midday, consider taking a power nap. napping at work for no longer than 10 to 20 minutes can give you the alertness boost you need to perform well. positive changes to your sleep habits won't happen overnight. with patience and practice, you'll find which sleep routines work best for your body and health. when you achieve better quality and quantity sleep, you can feel your best and improve your productivity at work.	avoid heavy meals and alcohol as these can disrupt your sleep in the middle of the night.
why do i always wake up very early?	waking up in the middle of the night when you would like to be asleep can be a frustrating experience. people wake up during the night for different reasons. identifying the cause of your middle - of - the - night wakings is the first step toward a full night of sound sleep. many factors cause people to wake up during the night, such as disruptions in the environment, lifestyle factors, health issues, and aging. we explore the possibilities of what might be waking you up at night. sleep hygiene tips often include the advice to maintain a quiet, dark, cool bedroom, as sensory disturbances can wake a person up during the night.	people wake up during the night for different reasons
what is sleep apnea?	learn more about how these medical devices can make a big difference in nighttime comfort for people with breathing issues. snoring can be a sore subject for bed partners, roommates, and family members. sleep apnea is a relatively common disorder in which people experience disrupted breathing while they are sleeping. narcolepsy is a sleep disorder that makes people feel excessively tired during the day despite getting an adequate amount of rest the previous night. this can lead to the irrepressible urge to sleep, culminating in sleep attacks that typically last for a few minutes.	a relatively common disorder in which people experience disrupted breathing while they are sleeping
why am i not able to sleep?	one - third of americans don't get enough sleep on a regular basis, according to the cdc. if you're one of them, creating a bedtime routine is one of the easiest steps you can take to enjoy better sleep. bedtime routines are a simple lifestyle change that can help your mind and body relax before bed. a bedtime routine is a set of activities you perform in the same order, every night, in the 30 to 60 minutes before you go to bed. bedtime routines can vary, but often include calming activities like taking a warm bath, reading, journaling, or meditation.	one - third of americans don't get enough sleep on a regular basis
why will people be awake during sleep?	nicotine and caffeine are both stimulants that can keep you awake. avoid heavy meals and alcohol as these can disrupt your sleep in the middle of the night. in the hour before bedtime, avoid artificial light from electronics, including tvs, cell phones, and computers. these lights can stimulate the brain and keep you awake longer. instead, try a quiet and relaxing activity. possibilities include a warm bath, meditation, reading, or listening to gentle music. if you find yourself drooping midday, consider taking a power nap. napping at work for no longer than 10 to 20 minutes can give you the alertness boost you need to perform well. positive changes to your sleep habits won't happen overnight. with patience and practice, you'll find which sleep routines work best for your body and health. when you achieve better quality and quantity sleep, you can feel your best and improve your productivity at work.	avoid heavy meals and alcohol
i am too busy to get enough sleep this week. will getting enough sleep next week help me offset my sleep debt this week?	going to bed a little earlier on weekends can help you recoup sleep debt without sleeping in too late and throwing off your circadian rhythm. you sleep more deeply when you're sleep - deprived, so just a little extra sleep can make a big difference. the best test is to pay attention to how you feel when you sleep in on weekends. do you feel awake and alert, or do you feel groggy and grumpy? if you feel refreshed and restored after sleep, then what you're doing is working. if you don't feel your best, it may be worth adjusting your weekend sleep schedule to align with your weekday schedule.	going to bed a little earlier on weekends
how can i reduce the frequency of waking up during sleep?	there are several strategies you can try to help you sleep through the night. follow a regular sleep schedule every day, even on weekends. avoid napping during the day, especially for longer than 30 minutes and past the late afternoon. adopt a calming bedtime routine to ease you into sleep each night. if you think exercise is keeping you up, switch your exercise routine to the morning to see if that helps. jotting down your thoughts can be especially helpful if you think stressful thoughts are waking you up during the night. get your worries out of your head and onto the paper.	avoid napping during the day, especially for longer than 30 minutes and past the late afternoon.
what's the best time to exercise?	however, some studies have shown just the opposite : that intense exercise may help people sleep more deeply. when a group of physically active adults exercised 90 minutes before bed, those who felt they had worked out harder had more restorative deep sleep than those who felt they had worked out less. they also fell asleep faster, woke up less during the night, and spent less time awake in bed. the best time to engage in high - intensity exercise may depend on chronotype, which refers to biological dispositions for sleeping earlier or later in the day. morning people or larks tend to rise and sleep earlier in the day, whereas evening people or owls rise and sleep later in the day.	chronotype, which refers to biological dispositions for sleeping earlier or later in the day
what is the recommended amount of caffeine in a day	a large cup of coffee can have up to 470 mg of caffeine content which is more than the daily recommended caffeine content. it is essential to read the fine print about what you're drinking. since there can be a lot of variation in the way people respond to and metabolize caffeine, talk to your doctor if you are unsure if your caffeine consumption is recommended. the recommended cut - off time for caffeine use is a minimum of six hours before bedtime. for example, if you typically go to bed at 10pm, avoiding caffeine after 4pm can help minimize sleep problems.	470 mg of caffeine content
how long should afternoon naps be	daytime sleeping doesn't have to interfere with your normal sleep schedule if you follow some guidelines. you might think that a longer nap produces more benefits, but sometimes less is more. a study found that naps lasting between 10 and 30 minutes are often the most beneficial. following a period of sleep deprivation, a 5 - minute nap results in very few advantages when compared to not napping at all. a 10 - minute afternoon nap, however, is shown to produce a number of immediate gains, including increased energy and cognitive function. the benefits of a 10 - minute nap can last as long as 155 minutes.	as long as 155 minutes
